{
  "schema_version": "1.0",
  "plan_id": "plan-d0c0e440c467f446",
  "run_id": "d0c0e440c467f446",
  "seed_id": "cwe476_plan_006",
  "seed": 1,
  "status": "APPLIED",
  "created_at": "2026-04-07T02:14:13Z",
  "targets": [
    {
      "target_id": "t0001",
      "file": "counter.c",
      "line": 41,
      "mutation_strategy": "remove_null_guard",
      "candidate_score": 1.0,
      "context": {
        "expression": "if (!c) return;",
        "function_name": "counter_destroy",
        "guarded_pointer": "c"
      }
    }
  ],
  "skipped_candidates": 3,
  "source_tree_hash": "9468702101220acb"
}
