{
  "schema_version": "1.0",
  "plan_id": "plan-ec50a5df4806aca9",
  "run_id": "ec50a5df4806aca9",
  "seed_id": "cwe122_plan_001",
  "seed": 1,
  "status": "APPLIED",
  "created_at": "2026-04-07T02:13:54Z",
  "targets": [
    {
      "target_id": "t0001",
      "file": "strvec.c",
      "line": 37,
      "mutation_strategy": "alloc_size_undercount",
      "candidate_score": 0.75,
      "context": {
        "expression": "char **newbuf = malloc(new_cap * sizeof(char *));",
        "function_name": "strvec_push"
      }
    }
  ],
  "skipped_candidates": 13,
  "source_tree_hash": "de7a8f35aa77c74f"
}
