{
  "schema_version": "1.0",
  "plan_id": "plan-ea129d06dc584e5a",
  "run_id": "ea129d06dc584e5a",
  "seed_id": "cwe416_plan_004",
  "seed": 3,
  "status": "APPLIED",
  "created_at": "2026-04-07T02:14:01Z",
  "targets": [
    {
      "target_id": "t0001",
      "file": "kvstore.c",
      "line": 44,
      "mutation_strategy": "insert_premature_free",
      "candidate_score": 0.65,
      "context": {
        "expression": "kv->num_buckets = KV_INITIAL_BUCKETS;",
        "function_name": "kvstore_new",
        "pointer_name": "kv"
      }
    }
  ],
  "skipped_candidates": 136,
  "source_tree_hash": "de7a8f35aa77c74f"
}
