{
  "schema_version": "1.0",
  "plan_id": "plan-5fb65ac3a7052507",
  "run_id": "5fb65ac3a7052507",
  "seed_id": "cwe401_plan_008",
  "seed": 3,
  "status": "APPLIED",
  "created_at": "2026-04-07T02:13:55Z",
  "targets": [
    {
      "target_id": "t0001",
      "file": "kvstore.c",
      "line": 40,
      "mutation_strategy": "remove_free_call",
      "candidate_score": 0.55,
      "context": {
        "expression": "free(kv);",
        "function_name": "kvstore_new"
      }
    }
  ],
  "skipped_candidates": 22,
  "source_tree_hash": "de7a8f35aa77c74f"
}
