{
  "schema_version": "1.0",
  "plan_id": "plan-0292699ce651e705",
  "run_id": "0292699ce651e705",
  "seed_id": "cwe415_plan_007",
  "seed": 1,
  "status": "APPLIED",
  "created_at": "2026-04-07T02:13:54Z",
  "targets": [
    {
      "target_id": "t0001",
      "file": "strvec.c",
      "line": 25,
      "mutation_strategy": "insert_double_free",
      "candidate_score": 0.55,
      "context": {
        "expression": "free(sv);",
        "function_name": "strvec_new"
      }
    }
  ],
  "skipped_candidates": 22,
  "source_tree_hash": "de7a8f35aa77c74f"
}
