{
  "schema_version": "1.0",
  "plan_id": "plan-3651af04f158a0bf",
  "run_id": "3651af04f158a0bf",
  "seed_id": "cwe416_plan_003",
  "seed": 2,
  "status": "APPLIED",
  "created_at": "2026-04-07T02:13:54Z",
  "targets": [
    {
      "target_id": "t0001",
      "file": "ringbuf.c",
      "line": 33,
      "mutation_strategy": "insert_premature_free",
      "candidate_score": 0.65,
      "context": {
        "expression": "rb->tail      = 0;",
        "function_name": "ringbuf_new",
        "pointer_name": "rb"
      }
    }
  ],
  "skipped_candidates": 136,
  "source_tree_hash": "de7a8f35aa77c74f"
}
