{
  "schema_version": "1.0",
  "plan_id": "plan-9b972c8aef719bf4",
  "run_id": "9b972c8aef719bf4",
  "seed_id": "cwe416_plan_006",
  "seed": 7,
  "status": "APPLIED",
  "created_at": "2026-04-07T02:13:54Z",
  "targets": [
    {
      "target_id": "t0001",
      "file": "kvstore.c",
      "line": 43,
      "mutation_strategy": "insert_premature_free",
      "candidate_score": 0.65,
      "context": {
        "expression": "memset(kv->buckets, 0, KV_INITIAL_BUCKETS * sizeof(KVEntry *));",
        "function_name": "kvstore_new",
        "pointer_name": "kv"
      }
    }
  ],
  "skipped_candidates": 136,
  "source_tree_hash": "de7a8f35aa77c74f"
}
