{
  "schema_version": "1.0",
  "plan_id": "plan-1c50a7bac379f44e",
  "run_id": "1c50a7bac379f44e",
  "seed_id": "cwe476_plan_009",
  "seed": 1,
  "status": "APPLIED",
  "created_at": "2026-04-07T02:13:55Z",
  "targets": [
    {
      "target_id": "t0001",
      "file": "arena.c",
      "line": 41,
      "mutation_strategy": "remove_null_guard",
      "candidate_score": 1.0,
      "context": {
        "expression": "if (!block) return NULL;",
        "function_name": "arena_alloc",
        "guarded_pointer": "block"
      }
    }
  ],
  "skipped_candidates": 20,
  "source_tree_hash": "de7a8f35aa77c74f"
}
