{
  "schema_version": "1.0",
  "plan_id": "plan-b58612ccecb7704c",
  "run_id": "b58612ccecb7704c",
  "seed_id": "cwe416_plan_002",
  "seed": 1,
  "status": "APPLIED",
  "created_at": "2026-04-07T02:14:01Z",
  "targets": [
    {
      "target_id": "t0001",
      "file": "arena.c",
      "line": 32,
      "mutation_strategy": "insert_premature_free",
      "candidate_score": 0.65,
      "context": {
        "expression": "a->next = NULL;",
        "function_name": "arena_new",
        "pointer_name": "a"
      }
    }
  ],
  "skipped_candidates": 136,
  "source_tree_hash": "de7a8f35aa77c74f"
}
