{
  "schema_version": "1.0",
  "plan_id": "plan-60b9f639c741c827",
  "run_id": "60b9f639c741c827",
  "seed_id": "cwe476-sandbox-graph-print-graph-002",
  "seed": 2,
  "status": "APPLIED",
  "created_at": "2026-04-07T01:51:50Z",
  "targets": [
    {
      "target_id": "t0001",
      "file": "graph.c",
      "line": 264,
      "mutation_strategy": "remove_null_guard",
      "candidate_score": 1.0,
      "context": {
        "expression": "if (!g) return;",
        "function_name": "graph_free",
        "guarded_pointer": "g"
      }
    }
  ],
  "skipped_candidates": 53,
  "source_tree_hash": "b1dc7a8c914dc0b7"
}
