{
  "schema_version": "1.0",
  "plan_id": "plan-c2fd14595431c2ae",
  "run_id": "c2fd14595431c2ae",
  "seed_id": "cwe476_plan_010",
  "seed": 2,
  "status": "APPLIED",
  "created_at": "2026-04-07T02:14:02Z",
  "targets": [
    {
      "target_id": "t0001",
      "file": "ringbuf.c",
      "line": 69,
      "mutation_strategy": "remove_null_guard",
      "candidate_score": 1.0,
      "context": {
        "expression": "if (!rb) return;",
        "function_name": "ringbuf_destroy",
        "guarded_pointer": "rb"
      }
    }
  ],
  "skipped_candidates": 20,
  "source_tree_hash": "de7a8f35aa77c74f"
}
