{
  "schema_version": "1.0",
  "plan_id": "plan-8534e104a0cce8fb",
  "run_id": "8534e104a0cce8fb",
  "seed_id": "cwe476-sandbox-graph-add-edge-008",
  "seed": 8,
  "status": "APPLIED",
  "created_at": "2026-04-07T01:54:16Z",
  "targets": [
    {
      "target_id": "t0001",
      "file": "graph.c",
      "line": 264,
      "mutation_strategy": "remove_null_guard",
      "candidate_score": 1.0,
      "context": {
        "expression": "if (!g) return;",
        "function_name": "graph_free",
        "guarded_pointer": "g"
      }
    }
  ],
  "skipped_candidates": 53,
  "source_tree_hash": "b1dc7a8c914dc0b7"
}
