{
  "schema_version": "1.0",
  "plan_id": "plan-64431cd804062949",
  "run_id": "64431cd804062949",
  "seed_id": "cwe122_plan_001",
  "seed": 1,
  "status": "APPLIED",
  "created_at": "2026-04-07T02:14:12Z",
  "targets": [
    {
      "target_id": "t0001",
      "file": "counter.c",
      "line": 18,
      "mutation_strategy": "alloc_size_undercount",
      "candidate_score": 0.55,
      "context": {
        "expression": "Counter *c = malloc(sizeof(Counter));",
        "function_name": "counter_create"
      }
    }
  ],
  "skipped_candidates": 1,
  "source_tree_hash": "9468702101220acb"
}
