{
  "schema_version": "1.0",
  "plan_id": "plan-dcb5f2bd6f548650",
  "run_id": "dcb5f2bd6f548650",
  "seed_id": "cwe415_plan_004",
  "seed": 4,
  "status": "APPLIED",
  "created_at": "2026-04-07T02:14:13Z",
  "targets": [
    {
      "target_id": "t0001",
      "file": "counter.c",
      "line": 43,
      "mutation_strategy": "insert_double_free",
      "candidate_score": 0.55,
      "context": {
        "expression": "free(c);",
        "function_name": "counter_destroy"
      }
    }
  ],
  "skipped_candidates": 2,
  "source_tree_hash": "9468702101220acb"
}
